{
  "$schema": "https://galaxy-ui.com/schema.json",
  "framework": "react",
  "typescript": true,
  "tailwind": {
    "config": "tailwind.config.js",
    "css": "src/app/globals.css",
    "baseColor": "slate",
    "cssVariables": true,
    "prefix": ""
  },
  "aliases": {
    "components": "@/components",
    "utils": "@/lib/utils",
    "ui": "@/components/ui",
    "lib": "@/lib"
  },
  "iconLibrary": "lucide"
}